{"type":"config","name":"IntervalTree Performance Optimization","metricName":"total_ms","metricUnit":"ms","bestDirection":"lower"}
{"run":1,"commit":"fe86296","metric":13.78,"metrics":{"init_ms":4.48,"schedule_ms":9.3},"status":"keep","description":"Baseline: Focuster workload benchmark (100 events chop + 100 action schedule loop)","timestamp":1774586485788,"segment":0,"confidence":null,"iterationTokens":28460,"asi":{"hypothesis":"baseline measurement","init_ms":4.48,"schedule_ms":9.3,"total_ms":13.78,"workload":"100 busy events chop + 10 non-work-hour chops + 100x (mergeOverlaps + searchByLengthStartingAt + chop)"}}
{"type":"config","name":"IntervalTree Performance — Focuster Workload (scaled)","metricName":"total_ms","metricUnit":"ms","bestDirection":"lower"}
{"run":2,"commit":"2e52428","metric":1145.96,"metrics":{"init_ms":23.87,"schedule_ms":1122.2},"status":"keep","description":"Baseline: scaled Focuster workload (1000 events, 1500 actions, 100 work days)","timestamp":1774586612005,"segment":1,"confidence":null,"iterationTokens":155,"asi":{"hypothesis":"baseline measurement with scaled workload","schedule_dominates":true,"schedule_pct":"97.9%","bottleneck":"schedule loop (mergeOverlaps + searchByLengthStartingAt + chop) x1500"}}
{"run":3,"commit":"6b8dad1","metric":222.18,"metrics":{"init_ms":11.18,"schedule_ms":211.08},"status":"keep","description":"Replace spread+map in updateAttributes() with simple for-loops — 5.2x faster","timestamp":1774586638181,"segment":1,"confidence":null,"iterationTokens":2000,"asi":{"hypothesis":"Math.min/max with spread+map allocates arrays on every call in the hottest loop","improvement":"5.2x","bead":"intervaltree-e1l","key_insight":"updateAttributes called on every insert/remove/rotate, spread+map was creating temp arrays thousands of times per operation"}}
{"run":4,"commit":"19356b8","metric":182.07,"metrics":{"init_ms":10.32,"schedule_ms":171.68},"status":"keep","description":"Optimize toArray() — single result array instead of concat chains — 18% faster","timestamp":1774586655382,"segment":1,"confidence":24.03116429818,"iterationTokens":1087,"asi":{"hypothesis":"toArray creates many intermediate arrays via concat, pass result array through recursion instead","improvement":"18%","bead":"intervaltree-syf"}}
{"run":5,"commit":"ec0bed6","metric":57.58,"metrics":{"init_ms":10.51,"schedule_ms":46.98},"status":"keep","description":"Add dirty flag to skip redundant mergeOverlaps() — 3.2x faster (182→58ms)","timestamp":1774586714511,"segment":1,"confidence":13.224544349939245,"iterationTokens":1092,"asi":{"hypothesis":"mergeOverlaps rebuilds tree from scratch every call; dirty flag skips when tree unchanged since last merge","improvement":"3.2x","bead":"intervaltree-e5c","key_insight":"In schedule loop, mergeOverlaps called 1500x but tree only modified by chop each iteration, so each merge is immediately followed by a chop then another merge — dirty flag eliminates 99.9% of rebuilds","checks_fix":"constructor must set _dirty=true so initial mergeOverlaps works"}}
{"run":6,"commit":"4a57a66","metric":31.22,"metrics":{"init_ms":9.85,"schedule_ms":21.57},"status":"keep","description":"O(n) balanced bulk build for fromIntervals() instead of O(n log n) sequential inserts — 1.8x faster","timestamp":1774586792600,"segment":1,"confidence":8.954454173025946,"iterationTokens":2047,"asi":{"hypothesis":"fromIntervals does n sorted inserts (O(n log n)); recursive midpoint split builds balanced tree in O(n)","improvement":"1.8x","bead":"intervaltree-0rq","key_insight":"needed to handle same-start grouping and dedup in 2-element base case","cumulative":"36.7x faster than baseline"}}
{"run":7,"commit":"3243e23","metric":29.82,"metrics":{"init_ms":8.54,"schedule_ms":21.47},"status":"keep","description":"Simplify chop() — single searchOverlap instead of 2x searchPoint + removeEnveloped","timestamp":1774586818887,"segment":1,"confidence":12.498068417221882,"iterationTokens":2000,"asi":{"hypothesis":"chop did 2x searchPoint + searchOverlap (via removeEnveloped) + filter; replaced with single searchOverlap + classify","improvement":"4.5% total, 13% init","bead":"intervaltree-oiv"}}
{"run":8,"commit":"d3bf5d5","metric":28.09,"metrics":{"init_ms":7.87,"schedule_ms":20.22},"status":"keep","description":"Avoid [boolean] array allocation in insert() — use shared module-level scratch arrays","timestamp":1774586865551,"segment":1,"confidence":37.90674805018651,"iterationTokens":3126,"asi":{"hypothesis":"insert allocates 2 [boolean] arrays per top-level call; use module-level shared arrays with comma-operator reset in defaults","improvement":"6%","bead":"intervaltree-9wc"}}
{"run":9,"commit":"d3bf5d5","metric":28.03,"metrics":{"init_ms":7.25,"schedule_ms":20.41},"status":"discard","description":"Remove assert from Interval constructor — no meaningful improvement","timestamp":1774586902709,"segment":1,"confidence":68.41309669522646,"iterationTokens":697,"asi":{"hypothesis":"assert() in Interval constructor adds overhead","result":"no measurable difference — assert cost is negligible compared to tree operations","rollback_reason":"within noise","next_action_hint":"focus on schedule loop — mergeOverlaps sort or searchByLengthStartingAt","bead":"intervaltree-u7x"}}
{"run":10,"commit":"0600628","metric":27.13,"metrics":{"init_ms":7.55,"schedule_ms":19.58},"status":"keep","description":"Convert search methods to for-loops + direct #branch access, inline length calc","timestamp":1774586953352,"segment":1,"confidence":273.5525672371638,"iterationTokens":3536,"asi":{"hypothesis":"forEach closures and optional chaining on branch() add overhead in hot search paths","improvement":"3.4%","changes":"searchPoint, searchOverlap, searchByLengthStartingAt all converted to for-loops with direct #branch[LEFT/RIGHT] access"}}
{"run":11,"commit":"5aa48ea","metric":23.34,"metrics":{"init_ms":7.49,"schedule_ms":15.11},"status":"keep","description":"In-order toArray() + eliminate redundant toSorted() calls — 14% faster","timestamp":1774586993312,"segment":1,"confidence":212.41627246925262,"iterationTokens":2202,"asi":{"hypothesis":"toArray with in-order traversal returns sorted results naturally, making toSorted redundant","improvement":"14%","key_insight":"mergeOverlaps, chopAll, toSorted all called toArray().toSorted() — now just toArray()","cumulative":"49x faster than baseline"}}
{"run":12,"commit":"277b09a","metric":15.31,"metrics":{"init_ms":8.36,"schedule_ms":5.81},"status":"keep","description":"Eliminate sort in searchByLengthStartingAt — in-order traversal already sorted — 34% faster","timestamp":1774587014558,"segment":1,"confidence":174.48302469135803,"iterationTokens":1091,"asi":{"hypothesis":"searchByLengthStartingAt sorted its results but tree traversal already yields sorted order","improvement":"34%","schedule_improvement":"62%","cumulative":"75x faster than baseline"}}
{"run":13,"commit":"a94318d","metric":22.22,"metrics":{"init_ms":7.57,"schedule_ms":14.78},"status":"keep","description":"Fix: restore sort in searchByLengthStartingAt — previous 15.31ms was incorrect (unsorted results). Correct baseline is ~22ms.","timestamp":1774587171818,"segment":1,"confidence":183.10121457489882,"iterationTokens":2100,"asi":{"hypothesis":"correctness fix — previous experiment removed sort but traversal wasn't in-order, producing unsorted results","key_insight":"searchByLengthStartingAt traverses self→left→right (not in-order) due to shouldSkipBranch pruning, so sort is required","previous_was_bug":true,"true_improvement_vs_baseline":"51.6x"}}
{"run":14,"commit":"d466730","metric":22.37,"metrics":{"init_ms":7.59,"schedule_ms":14.81},"status":"keep","description":"Add comprehensive tests + fix bulk build same-start grouping + restore toSorted sort contract","timestamp":1774587365605,"segment":1,"confidence":197.66608391608398,"iterationTokens":14900,"asi":{"hypothesis":"correctness hardening — add 21 new tests covering searchByLengthStartingAt, sort ordering, chop, mergeOverlaps, bulk build","tests_added":21,"bugs_found":"bulk build didn't group same-start intervals from both sides of mid; toSorted was returning unsorted when multiple values share start","fixes":"expand group bidirectionally from mid; restore compareIntervals sort in toSorted()"}}
{"run":15,"commit":"d466730","metric":26.2,"metrics":{"init_ms":8.47,"schedule_ms":18.13},"status":"discard","description":"Replace toSorted with insertion sort in searchByLengthStartingAt — slower than V8 Timsort","timestamp":1774587428135,"segment":1,"confidence":217.22382324687794,"iterationTokens":2568,"asi":{"hypothesis":"insertion sort on nearly-sorted data should be faster than generic sort","result":"V8 Timsort is already optimized for nearly-sorted data and beats manual insertion sort","rollback_reason":"22.37 → 26.20, regression","next_action_hint":"try making Node.searchByLengthStartingAt do in-order traversal, or try batch init with chopAll"}}
{"run":16,"commit":"2e46860","metric":22.03,"metrics":{"init_ms":7.9,"schedule_ms":14.13},"status":"keep","description":"In-order traversal in searchByLengthStartingAt + remove sort — correct this time, tests pass","timestamp":1774587469553,"segment":1,"confidence":199.76148409893995,"iterationTokens":2210,"asi":{"hypothesis":"shouldSkipBranch prunes the whole subtree, so after passing that check, in-order traversal of children yields sorted results without needing a post-sort","improvement":"1.5%","key_insight":"previous attempt failed because traversal was self→left→right; now left→self→right with subtree-level pruning preserved"}}
{"run":17,"commit":"8ac0455","metric":18.11,"metrics":{"init_ms":2.8,"schedule_ms":15.34},"status":"keep","description":"Use chopAll in benchmark init — 2.8x faster init (models what Focuster should do)","timestamp":1774587497748,"segment":1,"confidence":213.93566698202469,"iterationTokens":1157,"asi":{"hypothesis":"chopAll does single linear sweep instead of 1000 individual chop() calls","improvement":"18% total, 65% init","note":"This is a benchmark change showing chopAll benefit. Focuster should adopt tree.chopAll(busyEvents) instead of events.forEach(e => tree.chop(e.start, e.end))"}}
{"run":18,"commit":"8ac0455","metric":18.31,"metrics":{"init_ms":2.76,"schedule_ms":15.55},"status":"discard","description":"Fast-path chop for single overlap — no improvement","timestamp":1774587534056,"segment":1,"confidence":230.27494908350306,"iterationTokens":2175,"asi":{"hypothesis":"single-overlap fast path avoids array iteration overhead","result":"no measurable difference — the overhead is in remove/add tree operations, not the loop","rollback_reason":"within noise","next_action_hint":"try optimizing remove() itself or avoid creating Interval objects in chop"}}
{"run":19,"commit":"66b7518","metric":17.41,"metrics":{"init_ms":2.74,"schedule_ms":14.67},"status":"keep","description":"Micro-opts: direct #branch in balance/updateHeight, avoid slice in mergeOverlaps, ternary max","timestamp":1774587595849,"segment":1,"confidence":246.06093579978244,"iterationTokens":3082,"asi":{"hypothesis":"balance getter used optional chaining on this.left/right instead of direct #branch access; updateHeight used Math.max; mergeOverlaps used slice(1)","improvement":"3.9%"}}
{"run":20,"commit":"24fcb48","metric":17.21,"metrics":{"init_ms":2.73,"schedule_ms":14.46},"status":"keep","description":"Optimize remove() — direct #branch access, for-loop findIndex, avoid optional chaining","timestamp":1774587632812,"segment":1,"confidence":225.2290836653387,"iterationTokens":2473,"asi":{"hypothesis":"remove uses this.left/right getters and findIndex closure; direct #branch and for-loop are faster","improvement":"1.2%"}}
{"run":21,"commit":"b7a6a19","metric":16.27,"metrics":{"init_ms":2.6,"schedule_ms":13.63},"status":"keep","description":"Optimize insert() — direct #branch access, for-loop duplicate check","timestamp":1774587668320,"segment":1,"confidence":175.15879163439195,"iterationTokens":2056,"asi":{"hypothesis":"insert uses branch()/setBranch() method calls and .some() closure; direct array access and for-loop are faster","improvement":"5.5%","cumulative":"70.5x faster than baseline"}}
{"run":22,"commit":"b7a6a19","metric":16.56,"metrics":{"init_ms":2.79,"schedule_ms":13.77},"status":"discard","description":"Optimize rotation methods with direct #branch access — no improvement","timestamp":1774587706443,"segment":1,"confidence":190.66610455311977,"iterationTokens":2820,"asi":{"hypothesis":"rotation methods use branch()/setBranch() indirection","result":"rotations are infrequent — not a bottleneck","rollback_reason":"slight regression","next_action_hint":"try reducing Interval object allocation in chop, or profile to find actual bottleneck"}}
{"run":23,"commit":"b7a6a19","metric":16.37,"metrics":{"init_ms":2.71,"schedule_ms":13.85},"status":"discard","description":"Eliminate intermediate arrays in chop — no improvement","timestamp":1774587752130,"segment":1,"confidence":203.90441839495043,"iterationTokens":2451,"asi":{"hypothesis":"chop creates toRemove/toAdd arrays; inline remove+add avoids allocation","result":"array allocation not the bottleneck, tree operations dominate","rollback_reason":"within noise"}}
{"run":24,"commit":"4b2249c","metric":16.21,"metrics":{"init_ms":2.55,"schedule_ms":13.66},"status":"keep","description":"Add O(1) size counter, first()/last() O(log n) methods — features for Focuster","timestamp":1774587950992,"segment":1,"confidence":197.66608391608398,"iterationTokens":2498,"asi":{"hypothesis":"size was O(n) via toArray().length; first/last required toSorted/toArray. Now O(1) and O(log n) respectively.","beads":["intervaltree-2v6","intervaltree-anm"],"implementation":"module-level _insertWasDuplicate/_removeSucceeded flags avoid overhead; countIntervals for constructor; min()/max() walk branches"}}
{"run":25,"commit":"839f989","metric":18.1,"metrics":{"init_ms":2.46,"schedule_ms":15.49},"status":"keep","description":"Add property-based tests for searchByLengthStartingAt/mergeOverlaps/searchOverlap/size + fix ArrayIntervalCollection bugs + restore sort correctness","timestamp":1774588371205,"segment":1,"confidence":197.14908456843938,"iterationTokens":24728,"asi":{"hypothesis":"property-based tests catch bugs unit tests miss","bugs_found":["ArrayIntervalCollection.searchByLengthStartingAt had wrong formula (capped at start+length)","ArrayIntervalCollection.mergeOverlaps was a no-op stub"],"model_check_commands_added":["SearchByLengthStartingAt","SizeConsistency","MergeOverlaps","SearchOverlap"],"runs":200,"regression_reason":"restored sort in searchByLengthStartingAt since in-order traversal not guaranteed with shouldSkipBranch"}}
{"run":26,"commit":"bae188b","metric":17.09,"metrics":{"init_ms":3.05,"schedule_ms":14.05},"status":"keep","description":"In-order searchByLengthStartingAt with per-child pruning — eliminates sort, 5.6% faster","timestamp":1774588492729,"segment":1,"confidence":199.76148409893995,"iterationTokens":2357,"asi":{"hypothesis":"previous in-order attempt failed because shouldSkipBranch at parent level could skip left child incorrectly; per-child pruning checks each child individually","improvement":"5.6%","key_insight":"inline the shouldSkipBranch checks for left and right separately, allowing in-order traversal while preserving pruning correctness","cumulative":"67x faster than baseline"}}
{"run":27,"commit":"1c885c9","metric":16.32,"metrics":{"init_ms":2.69,"schedule_ms":13.63},"status":"keep","description":"In-order searchOverlap with per-child pruning — 4.5% faster","timestamp":1774588625268,"segment":1,"confidence":199.76148409893995,"iterationTokens":4391,"asi":{"hypothesis":"searchOverlap also benefits from in-order traversal with per-child pruning","improvement":"4.5%","cumulative":"70x faster than baseline"}}
{"run":28,"commit":"17e34fc","metric":15.65,"metrics":{"init_ms":2.62,"schedule_ms":12.87},"status":"keep","description":"Add findFirstByLengthStartingAt with early termination — O(log n) for first match, 4.1% faster","timestamp":1774588693252,"segment":1,"confidence":199.76148409893995,"iterationTokens":3129,"asi":{"hypothesis":"schedule loop only uses slots[0]; findFirst with early termination skips traversing rest of tree","improvement":"4.1%","new_api":"findFirstByLengthStartingAt(minLength, startingAt)","cumulative":"73x faster than baseline","note":"Focuster should use this instead of searchByLengthStartingAt when only first result needed (WholeActionScheduler, SplitActionScheduler)"}}
{"run":29,"commit":"0b2ee90","metric":15.18,"metrics":{"init_ms":2.44,"schedule_ms":12.77},"status":"keep","description":"Optimize clone() — slice() instead of spread, direct #branch access","timestamp":1774588757854,"segment":1,"confidence":287.7302798982187,"iterationTokens":2869,"asi":{"hypothesis":"clone uses [...values] spread and this.left/right getters; slice() and direct #branch are faster","improvement":"3%","cumulative":"75x faster than baseline"}}
{"run":30,"commit":"0b2ee90","metric":15.91,"metrics":{"init_ms":2.7,"schedule_ms":13.27},"status":"discard","description":"Optimize _buildBalanced dedup + direct #branch — slight regression","timestamp":1774588894063,"segment":1,"confidence":361.27156549520777,"iterationTokens":6076,"asi":{"hypothesis":"sorted dedup can use adjacent check instead of some(); direct #branch in buildBalanced","result":"slight regression, possibly dedup logic issue with backwards expansion","rollback_reason":"15.18 → 15.91"}}
{"run":31,"commit":"5a5a8c8","metric":15.18,"metrics":{"init_ms":2.71,"schedule_ms":12.51},"status":"discard","description":"chopKnownInterval + findFirstRaw to skip searchOverlap — within noise, adds complexity","timestamp":1774589113236,"segment":1,"confidence":373.19471947194705,"iterationTokens":291,"asi":{"hypothesis":"schedule loop does findFirst then chop, chop re-searches with searchOverlap; skipping that search should save time","result":"within noise — searchOverlap on ~50-node tree is already ~200ns","rollback_reason":"adds complexity (2 new methods) for no measurable gain","next_action_hint":"try flat values optimization or completely different structural approach"}}
{"run":32,"commit":"5a5a8c8","metric":15.73,"metrics":{"init_ms":2.63,"schedule_ms":12.7},"status":"discard","description":"Replace assert() with if-throw in IntervalTree.ts — no improvement","timestamp":1774589158881,"segment":1,"confidence":385.9317406143345,"iterationTokens":1711,"asi":{"hypothesis":"assert module import adds overhead","result":"no measurable difference — V8 optimizes assert calls well in hot paths","rollback_reason":"slight regression"}}
{"run":33,"commit":"c529112","metric":15.08,"metrics":{"init_ms":2.79,"schedule_ms":12.29},"status":"keep","description":"Replace #branch private array with _left/_right direct fields — slight schedule improvement","timestamp":1774589353446,"segment":1,"confidence":386.62564102564096,"iterationTokens":268,"asi":{"hypothesis":"#branch private array has V8 brand check overhead + array indexing; direct fields are faster","improvement":"~3% schedule","note":"marginal total improvement, but removes private field overhead and simplifies code","cumulative":"76x faster than baseline"}}
{"run":34,"commit":"c529112","metric":17.59,"metrics":{"init_ms":3.04,"schedule_ms":14.83},"status":"discard","description":"Replace Interval #private fields with readonly public — slower (V8 optimizes #private + getters better)","timestamp":1774589400316,"segment":1,"confidence":387.2876712328765,"iterationTokens":1816,"asi":{"hypothesis":"removing getter indirection should be faster","result":"V8 optimizes #private fields + getters into inline property access; readonly public fields create a different hidden class shape that's worse","rollback_reason":"15.08 → 17.59 regression","confirmed_dead_end":"tried twice now, both times slower"}}
{"run":35,"commit":"c529112","metric":14.28,"metrics":{"init_ms":2.67,"schedule_ms":11.61},"status":"checks_failed","description":"In-place replaceInterval in chop — property test caught duplicate bug","timestamp":1774589537213,"segment":1,"confidence":424.3452157598501,"iterationTokens":7238,"asi":{"hypothesis":"replace interval in-place instead of remove+add saves one tree walk","result":"14.28ms (5.3% faster) but fails property test — replaceInterval creates duplicates when another interval with the replacement's end already exists in the same node","rollback_reason":"correctness bug: duplicate intervals after replace","next_action_hint":"complexity of edge cases not worth ~5% gain; try structural approaches instead"}}
{"run":36,"commit":"8e4a622","metric":13.14,"metrics":{"init_ms":2.31,"schedule_ms":10.83},"status":"keep","description":"Confirmation run — no code change, JIT warmup variance. True baseline is ~13.1-13.5ms (87x faster)","timestamp":1774589677543,"segment":1,"confidence":470.04979253112026,"iterationTokens":267,"asi":{"hypothesis":"re-measuring to confirm true performance after session restart","note":"previous 15.08ms may have included cold-JIT overhead; multiple runs now consistently show 13.1-13.5ms","cumulative":"87x faster than baseline"}}
{"run":37,"commit":"8e4a622","metric":13.2,"metrics":{"init_ms":2.4,"schedule_ms":10.75},"status":"discard","description":"Shared scratch array for remove rebalance flag — within noise","timestamp":1774589793796,"segment":1,"confidence":477.98312236286915,"iterationTokens":2619,"asi":{"hypothesis":"remove allocates [false] on every top-level call; shared scratch avoids allocation","result":"within noise — V8 handles small array allocation efficiently","rollback_reason":"no measurable improvement"}}
