{"run":38,"commit":"8e4a622","metric":13.9,"metrics":{"init_ms":2.41,"schedule_ms":11.53},"status":"discard","description":"Replace splice with swap-pop in remove — regression, V8 deopt likely","timestamp":1774589829289,"segment":1,"confidence":486.1888412017167,"iterationTokens":1134,"asi":{"hypothesis":"splice is O(n), swap-pop is O(1) for removing from values array","result":"regression — values.length=0 or the swap may cause V8 hidden class change","rollback_reason":"13.14 → 13.90"}}
{"run":39,"commit":"5664bdb","metric":13.46,"metrics":{"init_ms":2.26,"schedule_ms":11.13},"status":"discard","description":"Inline constructor attributes — within noise","timestamp":1774589965191,"segment":1,"confidence":430.73003802281323,"iterationTokens":539,"asi":{"hypothesis":"avoid updateAttributes() method call in constructor for single-value case","result":"within noise, init slightly better but total unchanged","rollback_reason":"not a clear improvement"}}
{"run":40,"commit":"8a211ec","metric":11.91,"metrics":{"init_ms":2.32,"schedule_ms":9.59},"status":"keep","description":"Skip redundant sort in mergeOverlaps/chopAll via fromSortedIntervals — 9% faster","timestamp":1774590116802,"segment":1,"confidence":387.04778156996565,"iterationTokens":263,"asi":{"hypothesis":"mergeOverlaps and chopAll rebuild tree from already-sorted intervals; fromIntervals unnecessarily re-sorts","improvement":"9%","key_insight":"toSorted on already-sorted data still has O(n) comparison + array copy overhead","cumulative":"96x faster than baseline"}}
{"run":41,"commit":"8a211ec","metric":12.39,"metrics":{"init_ms":2.49,"schedule_ms":10.02},"status":"discard","description":"Inline remove+add in chop, eliminate toRemove/toAdd arrays — slight regression","timestamp":1774590181277,"segment":1,"confidence":370.6045751633988,"iterationTokens":2986,"asi":{"hypothesis":"intermediate arrays in chop add allocation overhead","result":"slight regression, V8 optimizes small array allocation well","rollback_reason":"11.91 → 12.39"}}
{"run":42,"commit":"0641f4c","metric":11.81,"metrics":{"init_ms":2.16,"schedule_ms":9.65},"status":"keep","description":"Simplify updateAttributes — skip minStart scan (all values share same start), reduce loop work","timestamp":1774590313738,"segment":1,"confidence":355.53291536050165,"iterationTokens":274,"asi":{"hypothesis":"all values in a node share the same start (tree invariant), so minStart from values is always this.start — skip scanning","improvement":"marginal but correct simplification","cumulative":"97x faster than baseline"}}
{"run":43,"commit":"0641f4c","metric":12.47,"metrics":{"init_ms":2.27,"schedule_ms":10.2},"status":"discard","description":"Derive maxLength from maxEnd in updateAttributes — slight regression","timestamp":1774590410520,"segment":1,"confidence":360.6200317965026,"iterationTokens":1293,"asi":{"hypothesis":"maxLength = maxEnd - start for same-start values, can skip per-element len computation","result":"slight regression, likely V8 JIT prefers the loop with both computations","rollback_reason":"11.81 → 12.47"}}
{"run":44,"commit":"0641f4c","metric":12.19,"metrics":{"init_ms":2.35,"schedule_ms":9.87},"status":"discard","description":"Simplify searchOverlap with early termination on this.start >= end — slight regression","timestamp":1774590446283,"segment":1,"confidence":365.8548387096777,"iterationTokens":1819,"asi":{"hypothesis":"since all values share this.start, can skip overlap check and right subtree when this.start >= end","result":"slight regression — the added branch is more expensive than the simplified inner check saves","rollback_reason":"11.81 → 12.19"}}
{"run":45,"commit":"0641f4c","metric":12.35,"metrics":{"init_ms":2.03,"schedule_ms":10.28},"status":"discard","description":"Guard Interval constructor asserts with DEBUG — init better but schedule worse, net regression","timestamp":1774590483428,"segment":1,"confidence":361.7703349282297,"iterationTokens":1586,"asi":{"hypothesis":"Interval constructor's 3 assert calls run on every new Interval even in production","result":"init improved 6% but schedule regressed 7% — adding if(DEBUG) branch may change constructor hidden class/JIT optimization","rollback_reason":"net regression 11.81 → 12.35","confirmed_dead_end":"assert overhead in Interval constructor is not the bottleneck"}}
{"run":46,"commit":"cf27632","metric":4.6,"metrics":{"init_ms":2.16,"schedule_ms":2.44},"status":"keep","description":"Preserve dirty flag in chop — chop never creates overlaps, eliminates 341 unnecessary mergeOverlaps rebuilds. 2.6x schedule improvement!","timestamp":1774590680634,"segment":1,"confidence":360.05047318611975,"iterationTokens":295,"asi":{"hypothesis":"chop calls remove+add which set _dirty=true, causing mergeOverlaps to rebuild after every chop. But chop only splits intervals, never creating overlaps.","improvement":"2.6x total (11.81 → 4.60), 4x schedule (10 → 2.44)","key_insight":"341 chop hits were each followed by a full mergeOverlaps rebuild (toArray + scan + fromSortedIntervals on ~250 intervals). Preserving dirty state eliminates all of them.","cumulative":"249x faster than baseline"}}
{"run":47,"commit":"1600214","metric":4.6,"metrics":{"init_ms":2.17,"schedule_ms":2.43},"status":"keep","description":"Also preserve dirty flag in chopAll — correctness fix, same perf","timestamp":1774590715845,"segment":1,"confidence":359.4834645669293,"iterationTokens":1998,"asi":{"hypothesis":"chopAll also sets dirty unnecessarily","result":"no perf change since init dirty was already cleared by first mergeOverlaps in schedule loop, but correct fix"}}
{"run":48,"commit":"0d8e653","metric":4.73,"metrics":{"init_ms":2.28,"schedule_ms":2.5},"status":"keep","description":"chopAll explicitly clears dirty flag — tree is rebuilt non-overlapping","timestamp":1774590757248,"segment":1,"confidence":358.91823899371076,"iterationTokens":1555,"asi":{"hypothesis":"chopAll large-range path rebuilds entire tree from non-overlapping sorted intervals, should clear dirty","result":"within noise but semantically correct"}}
{"run":49,"commit":"0d8e653","metric":4.48,"metrics":{"init_ms":2.19,"schedule_ms":2.29},"status":"checks_failed","description":"replaceValue in chop — property test caught duplicate again. 3rd attempt, same class of bug.","timestamp":1774590890659,"segment":1,"confidence":327.03724928366756,"iterationTokens":4057,"asi":{"hypothesis":"replace interval in-place for same-start flank avoids 1 tree walk","result":"duplicate intervals when replacement [A,S] already exists pre-chop","rollback_reason":"fundamental issue: replaceValue doesn't dedup, and dedup adds the complexity back","confirmed_dead_end":"in-place replacement in chop is fundamentally unsafe without dedup, which negates the savings. Tried 3 times."}}
{"run":50,"commit":"0d8e653","metric":4.71,"metrics":{"init_ms":2.3,"schedule_ms":2.41},"status":"discard","description":"replaceValue with hasDuplicateEnd check — overhead of dedup check negates savings","timestamp":1774591035478,"segment":1,"confidence":300.35789473684224,"iterationTokens":6352,"asi":{"hypothesis":"use replaceValue for same-start flanks with dedup check fallback","result":"hasDuplicateEnd tree walk adds overhead that negates the remove-avoidance savings","rollback_reason":"4.60 → 4.71, slight regression","confirmed_dead_end":"in-place replacement in chop: 4 attempts, all either incorrect or net-negative. The dedup check costs as much as the tree walk saved."}}
{"run":51,"commit":"0d8e653","metric":4.56,"metrics":{"init_ms":2.18,"schedule_ms":2.35},"status":"discard","description":"Sort chopAll ranges in-place — marginal gain but mutates caller's array (breaking API change)","timestamp":1774591146785,"segment":1,"confidence":299.5695538057742,"iterationTokens":747,"asi":{"hypothesis":"ranges.slice().sort() copies array unnecessarily; sort in-place saves allocation","result":"0.09ms improvement but mutates caller's input array","rollback_reason":"API contract change - original was non-mutating"}}
{"run":52,"commit":"f1e3292","metric":4.52,"metrics":{"init_ms":2.16,"schedule_ms":2.36},"status":"keep","description":"Optimize _buildBalanced — direct _left/_right assignment, avoid setBranch/branch methods, inline height calc","timestamp":1774591297315,"segment":1,"confidence":298.80628272251306,"iterationTokens":264,"asi":{"hypothesis":"_buildBalanced used setBranch/branch methods and Math.max; direct field access and ternary max are faster","improvement":"2.5% total, 5% init","cumulative":"253x faster than baseline"}}
{"run":53,"commit":"f1e3292","metric":4.6,"metrics":{"init_ms":2.12,"schedule_ms":2.47},"status":"discard","description":"Skip updateAttributes in Node constructor for buildBalanced — slight regression (V8 constructor deopt)","timestamp":1774591334344,"segment":1,"confidence":309.33333333333314,"iterationTokens":1129,"asi":{"hypothesis":"constructor calls updateAttributes unnecessarily for non-leaf _buildBalanced nodes","result":"adding skipAttributes parameter likely causes V8 constructor hidden class deopt","rollback_reason":"4.52 → 4.60"}}
{"run":54,"commit":"abfadd3","metric":4.62,"metrics":{"init_ms":2.23,"schedule_ms":2.42},"status":"discard","description":"Shared rebalance flag array in remove — within noise","timestamp":1774591540737,"segment":1,"confidence":320.62921348314603,"iterationTokens":6380,"asi":{"hypothesis":"remove allocates [false] per top-level call; shared array avoids allocation","result":"within noise at 4.5ms scale, same as at 13ms scale","rollback_reason":"no improvement","confirmed_dead_end":"shared scratch arrays for remove — tried twice at different scales, no gain"}}
{"run":55,"commit":"abfadd3","metric":4.68,"metrics":{"init_ms":2.26,"schedule_ms":2.49},"status":"discard","description":"Avoid deep clone in remove successor path — slight regression (successor is usually a leaf, clone is cheap)","timestamp":1774591616089,"segment":1,"confidence":321.53239436619714,"iterationTokens":968,"asi":{"hypothesis":"remove does deep clone of successor node; stealing data avoids clone","result":"successor is usually a leaf (1 value, no children), so clone is cheap. values.slice() adds overhead that negates savings.","rollback_reason":"4.52 → 4.68"}}
{"run":56,"commit":"e10d0ae","metric":4.75,"metrics":{"init_ms":2.24,"schedule_ms":2.49},"status":"discard","description":"Reusable scratch array for chop searchOverlap — regression (slice copy negates savings)","timestamp":1774591848015,"segment":1,"confidence":322.44067796610165,"iterationTokens":894,"asi":{"hypothesis":"reuse array for searchOverlap in chop to avoid allocation","result":"still need slice/copy since remove modifies tree during iteration; net regression","rollback_reason":"4.52 → 4.75"}}
{"run":57,"commit":"f56e874","metric":4.9,"metrics":{"init_ms":2.3,"schedule_ms":2.6},"status":"keep","description":"Optimize findOneByLengthStartingAt — eliminate filter/reduce/branch allocations. Not in benchmark hot path but helps Focuster.","timestamp":1774591935742,"segment":1,"confidence":313.58241758241746,"iterationTokens":2124,"asi":{"hypothesis":"findOneByLengthStartingAt used .filter() + .reduce() + .branch() — replaced with for-loop + direct _left/_right","result":"no benchmark change (expected), but eliminates allocations for Focuster's findByLength path","note":"Focuster code improvement, not benchmark optimization"}}
{"run":58,"commit":"c1f1240","metric":4.36,"metrics":{"init_ms":2.08,"schedule_ms":2.28},"status":"keep","description":"Simplify chop: eliminate toRemove/toAdd arrays, use index loops, overlapping IS the remove list","timestamp":1774592149677,"segment":1,"confidence":305.24064171122996,"iterationTokens":275,"asi":{"hypothesis":"chop created 2 extra arrays (toRemove/toAdd) and used 3 for-of loops; eliminated arrays and used 2 index loops","improvement":"within noise but fewer allocations, simpler code","cumulative":"263x best, ~253x typical"}}
{"run":59,"commit":"d464d4b","metric":4.38,"metrics":{"init_ms":2.04,"schedule_ms":2.34},"status":"keep","description":"Optimize chopAll sweep: index loop, avoid destructuring, inline min/max — ~5% init improvement","timestamp":1774593214118,"segment":1,"confidence":315.3591160220995,"iterationTokens":249,"asi":{"hypothesis":"chopAll sweep used for-of loop and destructuring [cStart, cEnd]; index loop and direct array access are faster","improvement":"~5% init (2.12→2.04ms)","cumulative":"261x best"}}
{"run":60,"commit":"3e2a120","metric":5.25,"metrics":{"init_ms":2.6,"schedule_ms":2.64},"status":"keep","description":"Fix _buildBalanced imbalance bug + chopAll dirty flag + clone _size + findFirst adjustment + new tests (111 unit, 200 model). Slight perf regression for correctness.","timestamp":1774621026057,"segment":1,"confidence":326.17142857142863,"iterationTokens":32168,"asi":{"hypothesis":"new model check commands exposed bugs","bugs_fixed":["_buildBalanced created unbalanced trees when same-start groups shifted the midpoint","chopAll set dirty=false incorrectly when pre-existing overlaps existed","clone didn't copy _size/_dirty","findFirstByLengthStartingAt didn't adjust start like findOne does"],"tests_added":24,"model_commands_added":["ChopAll","Clone","SearchEnvelop","FindFirst"],"perf_note":"_groupByStart adds overhead vs old _buildBalanced but guarantees balance"}}
{"run":61,"commit":"a1ff057","metric":4.85,"metrics":{"init_ms":2.45,"schedule_ms":2.4},"status":"keep","description":"Restore fast path: fromSortedIntervals for clean trees in chopAll, fromIntervals only when dirty","timestamp":1774621093218,"segment":1,"confidence":223.40508806262233,"iterationTokens":1161,"asi":{"hypothesis":"chopAll was using fromIntervals (with grouping) always; use fromSortedIntervals when tree was clean","improvement":"5.25 → 4.85ms (7.6%)","key_insight":"benchmark tree is clean when chopAll runs, so fast path applies"}}
{"run":62,"commit":"3d7f89b","metric":5.67,"metrics":{"init_ms":3.03,"schedule_ms":2.64},"status":"keep","description":"Add 3 more model check commands: FirstLast, ContainsOverlaps, RemoveEnveloped — 16 total commands, all pass","timestamp":1774623457819,"segment":1,"confidence":166.65693430656933,"iterationTokens":4551,"asi":{"hypothesis":"expand model check coverage to first/last, contains/overlaps, removeEnveloped","model_commands":16,"new_commands":["FirstLastCommand","ContainsOverlapsCommand","RemoveEnvelopedCommand"],"note":"metric variance is noise, no code change to hot paths"}}
